user_id,full_name,username,email,password,age,city,zipcode,user_bio,profile_photo
1,Julia Holmes,jholmes0,jholmes0@xing.com,Tzwedj8IaC3,33,San Francisco,94123,"Proin interdum mauris non ligula pellentesque ultrices. Phasellus id sapien in sapien iaculis congue. Vivamus metus arcu, adipiscing molestie, hendrerit at, vulputate vitae, nisl.

Aenean lectus. Pellentesque eget nunc. Donec quis orci eget orci vehicula condimentum.",http://media.istockphoto.com/photos/smiling-selfie-picture-id517224488?s=235x235
2,Brian Meyer,bmeyer1,bmeyer1@digg.com,SpxCKLF3dMk7,22,San Francisco,94123,"Pellentesque at nulla. Suspendisse potenti. Cras in purus eu magna vulputate luctus.

Cum sociis natoque penatibus et magnis dis parturient montes, nascetur ridiculus mus. Vivamus vestibulum sagittis sapien. Cum sociis natoque penatibus et magnis dis parturient montes, nascetur ridiculus mus.",http://media.istockphoto.com/photos/family-boat-ride-picture-id528634560?s=235x235
3,Maria Hunter,mhunter2,mhunter2@livejournal.com,8yuagH,73,San Francisco,94123,"Duis consequat dui nec nisi volutpat eleifend. Donec ut dolor. Morbi vel lectus in quam fringilla rhoncus.

Mauris enim leo, rhoncus sed, vestibulum sit amet, cursus id, turpis. Integer aliquet, massa id lobortis convallis, tortor risus dapibus augue, vel accumsan tellus nisi eu orci. Mauris lacinia sapien quis libero.",http://media.istockphoto.com/photos/family-selfie-in-the-nature-picture-id498919490?s=235x235
4,Anna Torres,atorres3,atorres3@ezinearticles.com,uRjgCO,77,San Francisco,94123,In quis justo. Maecenas rhoncus aliquam lacus. Morbi quis tortor id nulla ultrices aliquet.,http://media.istockphoto.com/photos/french-bulldog-taking-a-selfie-picture-id499374414?s=235x235
5,Bobby Stone,bstone4,bstone4@baidu.com,ok3uo8acryr,50,San Francisco,94123,"Maecenas leo odio, condimentum id, luctus nec, molestie sed, justo. Pellentesque viverra pede ac diam. Cras pellentesque volutpat dui.

Maecenas tristique, est et tempus semper, est quam pharetra magna, ac consequat metus sapien ut nunc. Vestibulum ante ipsum primis in faucibus orci luctus et ultrices posuere cubilia Curae; Mauris viverra diam vitae quam. Suspendisse potenti.",http://media.istockphoto.com/photos/girl-holding-instant-selfie-picture-id491117556?s=235x235
6,Jason Diaz,jdiaz5,jdiaz5@ucla.edu,XvCDZCmwXoHY,49,San Francisco,94123,"Mauris enim leo, rhoncus sed, vestibulum sit amet, cursus id, turpis. Integer aliquet, massa id lobortis convallis, tortor risus dapibus augue, vel accumsan tellus nisi eu orci. Mauris lacinia sapien quis libero.",http://media.istockphoto.com/photos/dog-portrait-picture-id474746577?s=235x235
7,Terry Hart,thart6,thart6@yellowbook.com,eHVmmu3KH,52,San Francisco,94123,"Donec diam neque, vestibulum eget, vulputate ut, ultrices vel, augue. Vestibulum ante ipsum primis in faucibus orci luctus et ultrices posuere cubilia Curae; Donec pharetra, magna vestibulum aliquet ultrices, erat tortor sollicitudin mi, sit amet lobortis sapien sapien non mi. Integer ac neque.",http://media.istockphoto.com/photos/outdoor-summer-portrait-of-young-woman-in-sunny-day-jeans-picture-id498338380?s=235x235
8,Brandon Rogers,brogers7,brogers7@si.edu,xU1fxtwj,65,San Francisco,94123,"Vestibulum ac est lacinia nisi venenatis tristique. Fusce congue, diam id ornare imperdiet, sapien urna pretium nisl, ut volutpat sapien arcu sed augue. Aliquam erat volutpat.

In congue. Etiam justo. Etiam pretium iaculis justo.",http://media.istockphoto.com/photos/parisian-selfie-picture-id478130948?s=235x235
9,Jimmy Ward,jward8,jward8@unblog.fr,FfKqpdFkL,56,San Francisco,94123,"Morbi porttitor lorem id ligula. Suspendisse ornare consequat lectus. In est risus, auctor sed, tristique in, tempus sit amet, sem.

Fusce consequat. Nulla nisl. Nunc nisl.",http://media.istockphoto.com/photos/five-friends-fool-around-taking-silly-selfie-picture-id498444603?s=235x235
10,Donald Vasquez,dvasquez9,dvasquez9@drupal.org,lmkw4hoLL,28,San Francisco,94123,"Integer tincidunt ante vel ipsum. Praesent blandit lacinia erat. Vestibulum sed magna at nunc commodo placerat.

Praesent blandit. Nam nulla. Integer pede justo, lacinia eget, tincidunt eget, tempus vel, pede.",http://placeimg.com/220/220/peoplehttp://media.istockphoto.com/photos/skateboarding-girl-skating-in-urban-city-streets-picture-id491935116?s=235x235
11,Larry Willis,lwillisa,lwillisa@blogger.com,NKxZvw0YQ4,78,San Francisco,94123,"Nulla ut erat id mauris vulputate elementum. Nullam varius. Nulla facilisi.

Cras non velit nec nisi vulputate nonummy. Maecenas tincidunt lacus at velit. Vivamus vel nulla eget eros elementum pellentesque.",http://media.istockphoto.com/photos/cat-sleeping-by-a-window-picture-id174178471?s=235x235
12,Ann Rivera,ariverab,ariverab@nhs.uk,0fBdc8qaUD,36,San Francisco,94123,Praesent id massa id nisl venenatis lacinia. Aenean sit amet justo. Morbi ut odio.,http://media.istockphoto.com/photos/flying-multicolored-balloons-picture-id504611320?s=235x235
13,Mary Mills,mmillsc,mmillsc@amazonaws.com,YqIrPzo,29,San Francisco,94123,"Maecenas tristique, est et tempus semper, est quam pharetra magna, ac consequat metus sapien ut nunc. Vestibulum ante ipsum primis in faucibus orci luctus et ultrices posuere cubilia Curae; Mauris viverra diam vitae quam. Suspendisse potenti.",http://media.istockphoto.com/photos/freedom-traveler-woman-picture-id585797228?s=235x235
14,Richard Davis,rdavisd,rdavisd@skyrock.com,XfvxeIefj,65,San Francisco,94123,"Morbi non lectus. Aliquam sit amet diam in magna bibendum imperdiet. Nullam orci pede, venenatis non, sodales sed, tincidunt eu, felis.

Fusce posuere felis sed lacus. Morbi sem mauris, laoreet ut, rhoncus aliquet, pulvinar sed, nisl. Nunc rhoncus dui vel sem.",http://media.istockphoto.com/photos/cat-taking-a-selfie-picture-id500280363?s=235x235
15,Sandra Simmons,ssimmonse,ssimmonse@hp.com,N55SfxpjsStw,62,San Francisco,94123,Nullam porttitor lacus at turpis. Donec posuere metus vitae ipsum. Aliquam non mauris.,http://media.istockphoto.com/photos/selfie-dogs-picture-id488938505?s=235x235
16,Emily Hicks,ehicksf,ehicksf@dot.gov,yrUfqdOag,42,San Francisco,94123,"Fusce posuere felis sed lacus. Morbi sem mauris, laoreet ut, rhoncus aliquet, pulvinar sed, nisl. Nunc rhoncus dui vel sem.",http://media.istockphoto.com/photos/young-woman-holding-a-coffee-picture-id187993228?s=235x235
17,Jennifer Robertson,jrobertsong,jrobertsong@hostgator.com,3rvtnDjKJY3O,61,San Francisco,94123,Integer tincidunt ante vel ipsum. Praesent blandit lacinia erat. Vestibulum sed magna at nunc commodo placerat.,http://media.istockphoto.com/photos/summer-travel-picture-id513420881?s=235x235
18,Jonathan Wells,jwellsh,jwellsh@tinyurl.com,OpYlxppslS,29,San Francisco,94123,Nulla ut erat id mauris vulputate elementum. Nullam varius. Nulla facilisi.,http://media.istockphoto.com/photos/snaap-a-self-portrait-of-the-good-times-picture-id161312818?s=235x235
19,Betty Henderson,bhendersoni,bhendersoni@tamu.edu,yNX3T15skuz,61,San Francisco,94123,Praesent id massa id nisl venenatis lacinia. Aenean sit amet justo. Morbi ut odio.,http://media.istockphoto.com/photos/chinese-woman-self-photographing-in-london-picture-id469868393?s=235x235
20,Shirley Reid,sreidj,sreidj@vimeo.com,gVI5O6JdeQH,66,San Francisco,94123,"Duis bibendum, felis sed interdum venenatis, turpis enim blandit mi, in porttitor pede justo eu massa. Donec dapibus. Duis at velit eu est congue elementum.",http://media.istockphoto.com/photos/smiling-friends-on-a-beach-picture-id457208271?s=235x235